{
  "schema_version": "1.0.0",
  "contract_revision": "2026-07-24.contract-first.1",
  "contract_bundle_hash": "sha256:0000000000000000000000000000000000000000000000000000000000000000",
  "run_id": "20260724T140000Z_failure-review-loop_a1b2c3",
  "project_id": "failure-review-loop",
  "generated_at": "2026-07-24T14:00:00Z",
  "status": "insufficient_data",
  "interpretation": "observational_only",
  "target_scope": {
    "improvement_target_ids": ["example-skill"],
    "target_set_hash": "sha256:0000000000000000000000000000000000000000000000000000000000000000",
    "contract_revision": "2026-07-24.contract-first.1",
    "contract_bundle_hash": "sha256:0000000000000000000000000000000000000000000000000000000000000000"
  },
  "baseline_run_ids": [],
  "current_valid_task_count": 2,
  "baseline_valid_task_count": 0,
  "target_change_detected": false,
  "deltas": {
    "attainment_rate": null,
    "outcome_coverage": null,
    "turn_count_median": null,
    "clarification_count_median": null,
    "repeated_clarification_count_median": null,
    "execution_attempt_count_median": null,
    "rework_count_median": null,
    "repeated_clarification_rate": null,
    "repeated_execution_rate": null,
    "unmet_expectation_rate": null
  }
}
